{
  "allocation": {
    "entries": [],
    "lock_groups": [],
    "solver_version": "ga019-trivial-1"
  },
  "attrs": {
    "pool_spares": {
      "mcu.uarts": [
        0,
        1,
        2
      ]
    },
    "resolutions": {
      "mcu.pwr": "rail:+3V3",
      "periph.pwr": "rail:+3V3"
    }
  },
  "escalations": [
    {
      "code": "AMBIGUOUS_NONEQUIV",
      "conflict": [
        "periph.uart demands 'uart' (qty 1)",
        "pool 'mcu.uarts' provides it (3 unit(s); 'uart' provides 'uart')",
        "role 'bitbang' capability provides it ('uart_bitbang' provides 'uart')",
        "the 2 candidate classes are not declared equivalent (no single pool spans them) and no selection policy or default is declared"
      ],
      "msg": "demand 'periph.uart' is satisfiable by 2 non-equivalent provider classes; the engine refuses to guess",
      "relaxation": "declare default=<candidate> on demand 'periph.uart' (the policy), or pin one provider via a layer-2 refinement",
      "subjects": [
        "periph.uart"
      ]
    }
  ],
  "grounds": [
    {
      "name": "GND"
    }
  ],
  "layer": 1,
  "pools": [
    {
      "name": "mcu.uarts",
      "port_signature": [
        "tx:out",
        "rx:in"
      ],
      "provides": "uart",
      "role": "mcu",
      "unit_count": 3
    }
  ],
  "rails": [
    {
      "name": "+3V3",
      "volts": 3.3
    }
  ],
  "roles": [
    {
      "capabilities": [
        {
          "iface": "power",
          "rail": "+3V3",
          "volts": 3.3
        }
      ],
      "id": "supply",
      "kind": "supply"
    },
    {
      "demands": [
        {
          "attrs": {
            "companions": [
              "decoupling_cap"
            ]
          },
          "id": "mcu.pwr",
          "iface": "power",
          "volts": 3.3
        }
      ],
      "id": "mcu",
      "kind": "mcu"
    },
    {
      "capabilities": [
        {
          "iface": "uart_bitbang"
        }
      ],
      "id": "bitbang",
      "kind": "gpio_bitbang"
    },
    {
      "demands": [
        {
          "id": "periph.pwr",
          "iface": "power",
          "volts": 3.3
        },
        {
          "id": "periph.uart",
          "iface": "uart"
        }
      ],
      "id": "periph",
      "kind": "uart_device"
    }
  ],
  "series": "A"
}
