{
  "allocation": {
    "entries": [
      {
        "chosen_by": "solver",
        "demand": "glue_a.nands",
        "locked_by": null,
        "pool": "quad.nands",
        "state": "sticky",
        "unit": 0
      },
      {
        "chosen_by": "solver",
        "demand": "glue_a.nands",
        "locked_by": null,
        "pool": "quad.nands",
        "state": "sticky",
        "unit": 1
      },
      {
        "chosen_by": "solver",
        "demand": "glue_b.nand",
        "locked_by": null,
        "pool": "quad.nands",
        "state": "sticky",
        "unit": 2
      }
    ],
    "lock_groups": [],
    "solver_version": "ga019-trivial-1"
  },
  "attrs": {
    "pool_spares": {
      "quad.nands": [
        3
      ]
    },
    "resolutions": {
      "quad.pwr": "rail:+3V3"
    }
  },
  "grounds": [
    {
      "name": "GND"
    }
  ],
  "layer": 1,
  "pools": [
    {
      "attrs": {
        "spare_handling": "tie_inputs"
      },
      "name": "quad.nands",
      "port_signature": [
        "a:in",
        "b:in",
        "y:out"
      ],
      "provides": "nand",
      "role": "quad",
      "unit_count": 4
    }
  ],
  "rails": [
    {
      "name": "+3V3",
      "volts": 3.3
    }
  ],
  "roles": [
    {
      "capabilities": [
        {
          "iface": "power",
          "rail": "+3V3",
          "volts": 3.3
        }
      ],
      "id": "supply",
      "kind": "supply"
    },
    {
      "demands": [
        {
          "attrs": {
            "companions": [
              "decoupling_cap"
            ]
          },
          "id": "quad.pwr",
          "iface": "power",
          "volts": 3.3
        }
      ],
      "id": "quad",
      "kind": "logic"
    },
    {
      "demands": [
        {
          "id": "glue_a.nands",
          "iface": "nand",
          "qty": 2
        }
      ],
      "id": "glue_a",
      "kind": "glue_logic"
    },
    {
      "demands": [
        {
          "id": "glue_b.nand",
          "iface": "nand"
        }
      ],
      "id": "glue_b",
      "kind": "glue_logic"
    }
  ],
  "series": "A"
}
